{
  "acceptance": {
    "can_promote": false,
    "improvements": [],
    "regressions": [
      "No modeled capability improvement was detected."
    ],
    "required_external_dependencies": [
      "local_health_privacy_review",
      "professional_care_boundary_review"
    ],
    "warnings": [
      "water_contamination_response_v2 comparison is stress_warn.",
      "crop_failure comparison is stress_warn.",
      "energy_outage_reserve_v2 comparison is stress_warn.",
      "External review dependencies remain explicit: local_health_privacy_review, professional_care_boundary_review."
    ]
  },
  "baseline_plan_id": "micro_commons_5_households_compiled_v0_care_health_resident_controlled_medication_continuity_kit_v0",
  "candidate_plan_id": "micro_commons_5_households_compiled_v0_care_health_resident_controlled_medication_continuity_kit_v0_care_health_resident_controlled_medication_continuity_kit_v0",
  "capability_deltas": [],
  "id": "impact_materialize_patch_care_health_resident_controlled_medication_continuity_kit_v0",
  "kind": "PatchImpactReport",
  "normal_year_comparison": {
    "bottlenecks": [
      "food model is partial: greenhouse output is not a complete nutrition plan"
    ],
    "labor_delta": {
      "baseline_status": "pass",
      "estimated_hours_per_resident_per_week_delta": 0.0,
      "labor_utilization_delta": 0.0,
      "replay_status": "pass",
      "runtime_failure_response_hours_delta": 0.0,
      "scenario_emergency_hours": 0.0,
      "storage_recovery_hours_delta": 0.0
    },
    "provisional": true,
    "resource_deltas": [
      {
        "baseline_status": "pass",
        "ending_balance_delta": 0.0,
        "minimum_balance_delta": 0.0,
        "net_per_day_delta": 0.0,
        "replay_status": "pass",
        "resource": "energy_kwh"
      },
      {
        "baseline_status": "pass",
        "ending_balance_delta": 0.0,
        "minimum_balance_delta": 0.0,
        "net_per_day_delta": 0.0,
        "replay_status": "pass",
        "resource": "food_servings"
      },
      {
        "baseline_status": "pass",
        "ending_balance_delta": 0.0,
        "minimum_balance_delta": 0.0,
        "net_per_day_delta": 0.0,
        "replay_status": "pass",
        "resource": "water_liters"
      }
    ],
    "status": "stable",
    "summary": [
      "Comparison status is stable.",
      "Replay scenario is normal_replay.",
      "Largest unmet-demand increase: energy_kwh (0.0).",
      "No resource minimum-balance drop was detected; stress appears as unmet demand, failure state, or labor/review burden.",
      "Unmet demand increased for 0 resource(s): none.",
      "Scenario emergency labor hours: 0.0.",
      "Blocked recovery review delta: 0.",
      "New blocked review domains: none."
    ],
    "unmet_need_deltas": [
      {
        "baseline_total_unmet": 0.0,
        "delta": 0.0,
        "first_unmet_day": null,
        "replay_total_unmet": 0.0,
        "resource": "energy_kwh"
      },
      {
        "baseline_total_unmet": 0.0,
        "delta": 0.0,
        "first_unmet_day": null,
        "replay_total_unmet": 0.0,
        "resource": "food_servings"
      },
      {
        "baseline_total_unmet": 0.0,
        "delta": 0.0,
        "first_unmet_day": null,
        "replay_total_unmet": 0.0,
        "resource": "labor_hours"
      },
      {
        "baseline_total_unmet": 0.0,
        "delta": 0.0,
        "first_unmet_day": null,
        "replay_total_unmet": 0.0,
        "resource": "procurement_units"
      },
      {
        "baseline_total_unmet": 0.0,
        "delta": 0.0,
        "first_unmet_day": null,
        "replay_total_unmet": 0.0,
        "resource": "sanitation_capacity"
      },
      {
        "baseline_total_unmet": 0.0,
        "delta": 0.0,
        "first_unmet_day": null,
        "replay_total_unmet": 0.0,
        "resource": "water_liters"
      }
    ]
  },
  "pattern_id": "care_health_resident_controlled_medication_continuity_kit_v0",
  "pattern_path": "patterns\\care_health\\care_health_resident_controlled_medication_continuity_kit_v0.yaml",
  "placement_target": {
    "label": "Care Room",
    "object_id": "structure_care_room",
    "relationship": "contained_module"
  },
  "provisional": true,
  "scenario_results": [
    {
      "bottlenecks": [
        "food model is partial: greenhouse output is not a complete nutrition plan",
        "scenario emergency work adds 14.0 labor hours"
      ],
      "labor_delta": {
        "baseline_status": "pass",
        "estimated_hours_per_resident_per_week_delta": 0.0,
        "labor_utilization_delta": 0.0,
        "replay_status": "pass",
        "runtime_failure_response_hours_delta": 0.0,
        "scenario_emergency_hours": 14.0,
        "storage_recovery_hours_delta": 0.0
      },
      "provisional": true,
      "resource_deltas": [
        {
          "baseline_status": "pass",
          "ending_balance_delta": 0.0,
          "minimum_balance_delta": 0.0,
          "net_per_day_delta": 0.0,
          "replay_status": "pass",
          "resource": "energy_kwh"
        },
        {
          "baseline_status": "pass",
          "ending_balance_delta": 0.0,
          "minimum_balance_delta": 0.0,
          "net_per_day_delta": 0.0,
          "replay_status": "pass",
          "resource": "food_servings"
        },
        {
          "baseline_status": "pass",
          "ending_balance_delta": 0.0,
          "minimum_balance_delta": 0.0,
          "net_per_day_delta": 0.0,
          "replay_status": "pass",
          "resource": "water_liters"
        }
      ],
      "scenario": "water_contamination_response_v2",
      "status": "stress_warn",
      "summary": [
        "Comparison status is stress_warn.",
        "Replay scenario is water_contamination_response_v2.",
        "Largest unmet-demand increase: energy_kwh (0.0).",
        "No resource minimum-balance drop was detected; stress appears as unmet demand, failure state, or labor/review burden.",
        "Unmet demand increased for 0 resource(s): none.",
        "Scenario emergency labor hours: 14.0.",
        "Blocked recovery review delta: 0.",
        "New blocked review domains: none."
      ],
      "unmet_need_deltas": [
        {
          "baseline_total_unmet": 0.0,
          "delta": 0.0,
          "first_unmet_day": null,
          "replay_total_unmet": 0.0,
          "resource": "energy_kwh"
        },
        {
          "baseline_total_unmet": 0.0,
          "delta": 0.0,
          "first_unmet_day": null,
          "replay_total_unmet": 0.0,
          "resource": "food_servings"
        },
        {
          "baseline_total_unmet": 1.55,
          "delta": 0.0,
          "first_unmet_day": 1,
          "replay_total_unmet": 1.55,
          "resource": "labor_hours"
        },
        {
          "baseline_total_unmet": 0.0,
          "delta": 0.0,
          "first_unmet_day": null,
          "replay_total_unmet": 0.0,
          "resource": "procurement_units"
        },
        {
          "baseline_total_unmet": 0.0,
          "delta": 0.0,
          "first_unmet_day": null,
          "replay_total_unmet": 0.0,
          "resource": "sanitation_capacity"
        },
        {
          "baseline_total_unmet": 0.0,
          "delta": 0.0,
          "first_unmet_day": null,
          "replay_total_unmet": 0.0,
          "resource": "water_liters"
        }
      ]
    },
    {
      "bottlenecks": [
        "food model is partial: greenhouse output is not a complete nutrition plan",
        "scenario emergency work adds 18.0 labor hours"
      ],
      "labor_delta": {
        "baseline_status": "pass",
        "estimated_hours_per_resident_per_week_delta": 0.0,
        "labor_utilization_delta": 0.0,
        "replay_status": "pass",
        "runtime_failure_response_hours_delta": 0.0,
        "scenario_emergency_hours": 18.0,
        "storage_recovery_hours_delta": 0.0
      },
      "provisional": true,
      "resource_deltas": [
        {
          "baseline_status": "pass",
          "ending_balance_delta": 0.0,
          "minimum_balance_delta": 0.0,
          "net_per_day_delta": 0.0,
          "replay_status": "pass",
          "resource": "energy_kwh"
        },
        {
          "baseline_status": "pass",
          "ending_balance_delta": 0.0,
          "minimum_balance_delta": 0.0,
          "net_per_day_delta": 0.0,
          "replay_status": "pass",
          "resource": "food_servings"
        },
        {
          "baseline_status": "pass",
          "ending_balance_delta": 0.0,
          "minimum_balance_delta": 0.0,
          "net_per_day_delta": 0.0,
          "replay_status": "pass",
          "resource": "water_liters"
        }
      ],
      "scenario": "crop_failure",
      "status": "stress_warn",
      "summary": [
        "Comparison status is stress_warn.",
        "Replay scenario is crop_failure.",
        "Largest unmet-demand increase: energy_kwh (0.0).",
        "No resource minimum-balance drop was detected; stress appears as unmet demand, failure state, or labor/review burden.",
        "Unmet demand increased for 0 resource(s): none.",
        "Scenario emergency labor hours: 18.0.",
        "Blocked recovery review delta: 0.",
        "New blocked review domains: none."
      ],
      "unmet_need_deltas": [
        {
          "baseline_total_unmet": 0.0,
          "delta": 0.0,
          "first_unmet_day": null,
          "replay_total_unmet": 0.0,
          "resource": "energy_kwh"
        },
        {
          "baseline_total_unmet": 0.0,
          "delta": 0.0,
          "first_unmet_day": null,
          "replay_total_unmet": 0.0,
          "resource": "food_servings"
        },
        {
          "baseline_total_unmet": 1.3,
          "delta": 0.0,
          "first_unmet_day": 1,
          "replay_total_unmet": 1.3,
          "resource": "labor_hours"
        },
        {
          "baseline_total_unmet": 0.0,
          "delta": 0.0,
          "first_unmet_day": null,